set binlog_format=row;
set sql_log_flashback=1;
flush logs;
use test;

******* ddl test

xxx 1.test flashback create table sql
before:
show tables;
Tables_in_test
create table t1 (a int);
insert into t1 value (1);
after create table and insert:
show tables;
Tables_in_test
t1
select * from t1;
a
1
flush logs;
after flashback:
show tables;
Tables_in_test
xxx

xxx 2.test flashback drop sql
create table t1 (a int);
insert into t1 value (1);
before:
show tables;
Tables_in_test
t1
select * from t1;
a
1
drop table t1;
after drop table:
show tables;
Tables_in_test
flush logs;
after flashback:
show tables;
Tables_in_test
t1
select * from t1;
a
1
drop table t1;
xxx

xxx3.test flashback add column sql
create table t1 (a int);
insert into t1 value (1);
before:
show create table t1;
Table	Create Table
t1	CREATE TABLE `t1` (
  `a` int(11) DEFAULT NULL
) ENGINE=InnoDB DEFAULT CHARSET=latin1
select * from t1;
a
1
alter table t1 add column b int, ALGORITHM=COPY;
update t1 set b=2;
after add column b int and update b:
show create table t1;
Table	Create Table
t1	CREATE TABLE `t1` (
  `a` int(11) DEFAULT NULL,
  `b` int(11) DEFAULT NULL
) ENGINE=InnoDB DEFAULT CHARSET=latin1
select * from t1;
a	b
1	2
flush logs;
after flashback:
show create table t1;
Table	Create Table
t1	CREATE TABLE `t1` (
  `a` int(11) DEFAULT NULL
) ENGINE=InnoDB DEFAULT CHARSET=latin1
select * from t1;
a
1
drop table t1;
xxx

xxx 4.test flashback drop column sql
create table t1 (a int);
insert into t1 value (1);
alter table t1 add column b int, ALGORITHM=COPY;
update t1 set b=2;
before:
show create table t1;
Table	Create Table
t1	CREATE TABLE `t1` (
  `a` int(11) DEFAULT NULL,
  `b` int(11) DEFAULT NULL
) ENGINE=InnoDB DEFAULT CHARSET=latin1
select * from t1;
a	b
1	2
alter table t1 drop column b, ALGORITHM=COPY;
after drop column b:
show create table t1;
Table	Create Table
t1	CREATE TABLE `t1` (
  `a` int(11) DEFAULT NULL
) ENGINE=InnoDB DEFAULT CHARSET=latin1
select * from t1;
a
1
flush logs;
after flashback:
show create table t1;
Table	Create Table
t1	CREATE TABLE `t1` (
  `a` int(11) DEFAULT NULL,
  `b` int(11) DEFAULT NULL
) ENGINE=InnoDB DEFAULT CHARSET=latin1
select * from t1;
a	b
1	2
drop table t1;
xxx

